{
  "$id": "http://joinsynapes.com/schemas/sfdr.json",
  "$schema": "http://json-schema.org/draft-07/schema#",
  "title": "SFDR Disclosure",
  "description": "Schema for Sustainable Finance Disclosure Regulation (SFDR) reporting objects.",
  "type": "object",
  "properties": {
    "entityId": {
      "type": "string",
      "description": "Unique identifier for the reporting entity."
    },
    "disclosureDate": {
      "type": "string",
      "format": "date",
      "description": "Date of the SFDR disclosure (YYYY-MM-DD)."
    },
    "indicators": {
      "type": "array",
      "description": "List of principal adverse impact indicators.",
      "items": {
        "type": "object",
        "properties": {
          "indicatorId": { "type": "string", "description": "ID of the indicator (e.g., GHG emissions, gender pay gap)." },
          "value": { "type": ["number", "string", "boolean"], "description": "Value of the indicator." },
          "unit": { "type": "string", "description": "Unit of measurement (if applicable)." }
        },
        "required": ["indicatorId", "value"]
      },
      "minItems": 1
    },
    "productType": {
      "type": "string",
      "description": "Type of financial product (e.g., fund, portfolio, mandate)."
    },
    "esgStrategy": {
      "type": "string",
      "description": "Description of the ESG strategy applied."
    },
    "referencePeriod": {
      "type": "string",
      "description": "Reference period for the disclosure (e.g., 2024, Q1-2025)."
    },
    "notes": {
      "type": "string",
      "description": "Additional notes or comments."
    }
  },
  "required": ["entityId", "disclosureDate", "indicators"],
  "additionalProperties": false
}
