{
  "entityId": "entity-001",
  "disclosureDate": "2025-06-16",
  "indicators": [
    { "indicatorId": "GHG", "value": 100.5, "unit": "tCO2e" },
    { "indicatorId": "GPG", "value": 0.85, "unit": "ratio" }
  ],
  "productType": "fund",
  "esgStrategy": "Best-in-class",
  "referencePeriod": "2024",
  "notes": "All indicators are within expected range."
}
